[
  {
    "transaction_id": "V-CLEAN",
    "risk_level": "BAJO",
    "risk_score": 0.0,
    "confidence": 1.0,
    "risk_factors": [],
    "reasoning": "No se detectaron indicadores de riesgo significativos en la transacci\u00f3n, incluyendo dispositivos, comportamientos y cuenta destino, lo que sugiere una transacci\u00f3n leg\u00edtima.",
    "signals": {
      "device": {
        "is_emulator": false,
        "anomalous_ip": false,
        "suspicious_typing_speed": false,
        "is_rooted": false,
        "device_fingerprint": "b23a6a8439c0dde5",
        "device_risk_score": 0.0,
        "behavioral_risk_score": 0.0,
        "suspicious_navigation": false,
        "suspicious_amount_pattern": false,
        "reasons": []
      },
      "mule_score": 0.0
    },
    "hitl_required": false,
    "facial_score": null,
    "facial_passed": null,
    "voice_verified": null,
    "blocked": false,
    "report": null,
    "timestamp": "2026-02-22T21:51:12.270685"
  },
  {
    "transaction_id": "V-FRAUD",
    "risk_level": "ALTO",
    "risk_score": 0.85,
    "confidence": 0.9,
    "risk_factors": [
      "emulador detectado",
      "IP an\u00f3mala",
      "cuenta destino con mule score alto"
    ],
    "reasoning": "La transacci\u00f3n presenta m\u00faltiples indicadores de riesgo, incluyendo el uso de un emulador y una IP an\u00f3mala, lo que sugiere una posible suplantaci\u00f3n de identidad. Adem\u00e1s, la cuenta destino tiene un mule score alto, lo que indica que es probablemente una cuenta utilizada para lavar dinero o realizar actividades fraudulentas.",
    "signals": {
      "device": {
        "is_emulator": true,
        "anomalous_ip": true,
        "suspicious_typing_speed": false,
        "is_rooted": false,
        "device_fingerprint": "b23a6a8439c0dde5",
        "device_risk_score": 0.55,
        "behavioral_risk_score": 0.0,
        "suspicious_navigation": false,
        "suspicious_amount_pattern": false,
        "reasons": [
          "emulator_detected",
          "anomalous_ip"
        ]
      },
      "mule_score": 1.0
    },
    "hitl_required": false,
    "facial_score": null,
    "facial_passed": null,
    "voice_verified": null,
    "blocked": true,
    "report": "Se ha detectado una transacci\u00f3n sospechosa de suplantaci\u00f3n de identidad con el ID V-FRAUD, que intentaba transferir 25000.0 USD desde la cuenta USER-001 a la cuenta ACC-BLOCKED-001. El an\u00e1lisis de la transacci\u00f3n ha revelado un nivel de riesgo alto, con un score de riesgo de 0.85, lo que indica una probable actividad fraudulenta.\n\nLa evidencia detectada incluye el uso de un emulador y una IP an\u00f3mala, lo que sugiere que el dispositivo utilizado para realizar la transacci\u00f3n no es leg\u00edtimo. Adem\u00e1s, la cuenta destino tiene un mule score alto de 1.0, lo que indica que es probablemente una cuenta utilizada para lavar dinero o realizar actividades fraudulentas. Estos factores de riesgo, combinados con la detecci\u00f3n de un emulador y una IP an\u00f3mala, confirman la sospecha de suplantaci\u00f3n de identidad.\n\nLa transacci\u00f3n ha sido bloqueada para prevenir cualquier posible p\u00e9rdida financiera. El bloqueo de la transacci\u00f3n es una medida preventiva para proteger los activos de nuestros clientes y evitar que los fraudulentos aprovechen nuestras plataformas para realizar actividades il\u00edcitas. La cuenta destino ACC-BLOCKED-001 ha sido identificada como una cuenta de alto riesgo y se est\u00e1n tomando medidas adicionales para investigar y prevenir futuras actividades fraudulentas.\n\nSe recomienda realizar una revisi\u00f3n exhaustiva de la cuenta USER-001 para determinar si ha sido comprometida y tomar medidas para proteger la identidad y los activos del cliente. Adem\u00e1s, se sugiere monitorear de cerca las transacciones futuras para detectar cualquier actividad sospechosa y tomar medidas preventivas para evitar que se repitan incidentes similares. La seguridad de nuestros clientes es nuestra prioridad, y estamos comprometidos con la prevenci\u00f3n y detecci\u00f3n de actividades fraudulentas en nuestras plataformas.",
    "timestamp": "2026-02-22T21:52:52.854406"
  },
  {
    "transaction_id": "V-SUSPECT",
    "risk_level": "MEDIO",
    "risk_score": 0.36,
    "confidence": 0.6,
    "risk_factors": [
      "Mule Score alto",
      "Monto significativo"
    ],
    "reasoning": "La transacci\u00f3n presenta un Mule Score de 0.72, lo que sugiere que la cuenta destino podr\u00eda ser una cuenta mula, y el monto de 4000.0 USD es significativo. Aunque no hay indicadores de riesgo del dispositivo ni de comportamiento, estos factores justifican una clasificaci\u00f3n de riesgo MEDIO y requieren verificaci\u00f3n adicional del usuario.",
    "signals": {
      "device": {
        "is_emulator": false,
        "anomalous_ip": false,
        "suspicious_typing_speed": false,
        "is_rooted": false,
        "device_fingerprint": "b23a6a8439c0dde5",
        "device_risk_score": 0.0,
        "behavioral_risk_score": 0.0,
        "suspicious_navigation": false,
        "suspicious_amount_pattern": false,
        "reasons": []
      },
      "mule_score": 0.72
    },
    "hitl_required": true,
    "facial_score": 0.9729,
    "facial_passed": true,
    "voice_verified": false,
    "blocked": true,
    "report": "Se ha detectado una transacci\u00f3n sospechosa con el ID V-SUSPECT, que involucra una transferencia de 4000.0 USD desde la cuenta USER-001 hacia la cuenta ACC-MULE-003. El an\u00e1lisis realizado indica un nivel de riesgo MEDIO, con un score de riesgo de 0.36, debido principalmente a un Mule Score alto y un monto significativo. Aunque no se han detectado se\u00f1ales de riesgo del dispositivo ni de comportamiento, estos factores justifican una clasificaci\u00f3n de riesgo MEDIO y requieren verificaci\u00f3n adicional del usuario.\n\nLa evidencia detectada incluye un Mule Score de 0.72, lo que sugiere que la cuenta destino podr\u00eda ser una cuenta mula. Adem\u00e1s, el monto de la transacci\u00f3n es significativo, lo que aumenta el riesgo de fraude. Las se\u00f1ales de dispositivo no han detectado anomal\u00edas, con un device risk score y un behavioral risk score de 0.0. El reconocimiento facial ha pasado con un score de 0.9729, sin embargo, el voice bot no ha sido verificado.\n\nLa transacci\u00f3n ha sido bloqueada como medida de precauci\u00f3n para evitar posibles p\u00e9rdidas financieras. Esto permitir\u00e1 realizar una verificaci\u00f3n adicional del usuario y de la transacci\u00f3n para determinar si se trata de una operaci\u00f3n leg\u00edtima o de un intento de fraude. El bloqueo de la transacci\u00f3n es una medida temporal hasta que se complete la verificaci\u00f3n y se tomen las medidas adecuadas.\n\nSe recomienda realizar una verificaci\u00f3n adicional del usuario y de la transacci\u00f3n para determinar la legitimidad de la operaci\u00f3n. Esto puede incluir la verificaci\u00f3n de la identidad del usuario, la confirmaci\u00f3n de la transacci\u00f3n y la evaluaci\u00f3n de la cuenta destino para determinar si se trata de una cuenta mula. Adem\u00e1s, se sugiere monitorear la cuenta USER-001 y la cuenta ACC-MULE-003 para detectar cualquier actividad sospechosa adicional y tomar medidas para prevenir futuras transacciones fraudulentas.",
    "timestamp": "2026-02-22T21:53:34.363951"
  }
]